{
  "decision_version": 1,
  "source_commit": "43c9a763459021d6feb7fc90c37ef13dbe4824d1",
  "iso_639_3": "keo",
  "atlas_language_id": "language-keo",
  "reviewer_id": "reviewer-automated-source-audit",
  "reviewed_at": "2026-10-05",
  "checks": {
    "language_identity": "approved",
    "variety_identity": "approved",
    "geographic_scope": "approved",
    "licence": "approved",
    "access": "approved",
    "source_links": "approved"
  },
  "decision": "defer",
  "notes": "Glottolog identifies Kakwa as ISO keo across the DRC, South Sudan, and Uganda. The pinned Africa Corpus edition carries the same cross-border scope and is marked copyrighted. Text remains unavailable and restricted; named human approval cannot grant redistribution rights.",
  "evidence_urls": [
    "https://glottolog.org/resource/languoid/id/kakw1240",
    "https://huggingface.co/datasets/AfriSpeech/africa-corpus"
  ]
}
