{
  "decision_version": 1,
  "source_commit": "43c9a763459021d6feb7fc90c37ef13dbe4824d1",
  "iso_639_3": "lgm",
  "atlas_language_id": "language-lgm",
  "reviewer_id": "reviewer-automated-source-audit",
  "reviewed_at": "2026-10-05",
  "checks": {
    "language_identity": "approved",
    "variety_identity": "approved",
    "geographic_scope": "approved",
    "licence": "approved",
    "access": "approved",
    "source_links": "approved"
  },
  "decision": "defer",
  "notes": "Glottolog identifies Lega-Mwenga as ISO lgm in the DRC and distinguishes it from Lega-Shabunda. The pinned Africa Corpus package marks the exact edition copyrighted, so text remains unavailable and redistribution restricted. Human approval cannot remove that restriction.",
  "evidence_urls": [
    "https://glottolog.org/resource/languoid/id/lega1250",
    "https://huggingface.co/datasets/AfriSpeech/africa-corpus"
  ]
}
