{
  "decision_version": 1,
  "source_commit": "43c9a763459021d6feb7fc90c37ef13dbe4824d1",
  "iso_639_3": "tap",
  "atlas_language_id": "language-tap",
  "reviewer_id": "reviewer-automated-source-audit",
  "reviewed_at": "2026-10-06",
  "checks": {
    "language_identity": "approved",
    "variety_identity": "approved",
    "geographic_scope": "approved",
    "licence": "approved",
    "access": "approved",
    "source_links": "approved"
  },
  "decision": "defer",
  "notes": "Glottolog identifies Taabwa/Tabwa as ISO tap across the DRC and Zambia. The official eBible edition is explicitly DRC-labelled and CC BY-SA 4.0, and the pinned checksum and coverage reconcile. Its New Testament title conflicts with the 12 available Old Testament books or portions; attribution, ShareAlike, discrepancy disclosure, and named human review remain required.",
  "evidence_urls": [
    "https://glottolog.org/resource/languoid/id/taab1238",
    "https://ebible.org/Scriptures/details.php?id=tap"
  ]
}
