{
  "decision_version": 1,
  "source_commit": "43c9a763459021d6feb7fc90c37ef13dbe4824d1",
  "iso_639_3": "buu",
  "atlas_language_id": "language-buu",
  "reviewer_id": "reviewer-automated-source-audit",
  "reviewed_at": "2026-10-05",
  "checks": {
    "language_identity": "approved",
    "variety_identity": "approved",
    "geographic_scope": "approved",
    "licence": "approved",
    "access": "approved",
    "source_links": "approved"
  },
  "decision": "defer",
  "notes": "Glottolog identifies Budu as ISO buu in the DRC. The pinned Africa Corpus package applies the same DRC label to both selected editions and marks both copyrighted. Text remains unavailable and restricted; human approval cannot authorize redistribution.",
  "evidence_urls": [
    "https://glottolog.org/resource/languoid/id/budu1250",
    "https://huggingface.co/datasets/AfriSpeech/africa-corpus"
  ]
}
