{
  "decision_version": 1,
  "source_commit": "43c9a763459021d6feb7fc90c37ef13dbe4824d1",
  "iso_639_3": "khy",
  "atlas_language_id": "language-khy",
  "reviewer_id": "reviewer-automated-source-audit",
  "reviewed_at": "2026-10-05",
  "checks": {
    "language_identity": "approved",
    "variety_identity": "approved",
    "geographic_scope": "approved",
    "licence": "approved",
    "access": "approved",
    "source_links": "approved"
  },
  "decision": "defer",
  "notes": "Glottolog identifies Kele-Foma/Lokele as ISO khy in the DRC. The pinned Africa Corpus edition is explicitly Kele/Lokele, DRC-labelled, and copyrighted. Text remains unavailable and restricted; named human approval cannot grant redistribution rights.",
  "evidence_urls": [
    "https://glottolog.org/resource/languoid/id/kele1255",
    "https://huggingface.co/datasets/AfriSpeech/africa-corpus"
  ]
}
