{
  "decision_version": 1,
  "source_commit": "43c9a763459021d6feb7fc90c37ef13dbe4824d1",
  "iso_639_3": "nyj",
  "atlas_language_id": "language-nyj",
  "reviewer_id": "reviewer-automated-source-audit",
  "reviewed_at": "2026-10-06",
  "checks": {
    "language_identity": "approved",
    "variety_identity": "approved",
    "geographic_scope": "approved",
    "licence": "unresolved",
    "access": "approved",
    "source_links": "approved"
  },
  "decision": "defer",
  "notes": "Glottolog identifies Nyanga/Kinyanga as ISO nyj in the DRC, and the official YouVersion page confirms the selected four-book edition and publisher. Package public-domain metadata conflicts with the absence of explicit open terms on the publisher page, so redistribution remains restricted pending written permission or matching licence evidence. Licence and named human review remain blockers.",
  "evidence_urls": [
    "https://glottolog.org/resource/languoid/id/nyan1304",
    "https://www.bible.com/versions/4564-nyj-traduction-bilbe-en-kinyanga"
  ]
}
